{
    "$schema": "https://json-schema.org/draft/2020-12/schema",
    "apiVersion": "v2.0",
    "beaconId": "org.example.beacon.v2",
    "receivedRequestSummary": {
        "apiVersion": "2.0",
        "pagination": {
            "limit": 10,
            "skip": 0
        },
        "requestedGranularity": "count",
        "requestedSchemas": [
            {
                "entryType": "EntryTypeB",
                "schema": "entry-typeB-schema-v1.0"
            }
        ],
        "testMode": true
    },
    "returnedGranularity": "count",
    "returnedSchemas": [
        {
            "entryType": "EntryTypeB",
            "schema": "entry-typeB-schema-v1.0"
        }
    ]
}